{"checked_at":"2026-07-28T00:00:00Z","registry_id":"venue-authority-registry-v1","schema_version":"1.0.0","venues":[{"governance_note":"Approved TMLR host allowlist; release governance must separately verify authority and currency.","official_hosts":["jmlr.org","openreview.net"],"profiles":[{"profile_id":"tmlr-current-general","profile_locator":"venues/profiles/tmlr-current.json","profile_sha256":"f790e27a04839ab3c812c12eb7e1e91f8dd6658c20fa11e04151de2d789f1992","profile_version":"1.0.0","source_manifest_locator":"venues/source-manifests/tmlr-current.json","source_sha256":"8740691bc7c66bd3c2e9882268097ed9e429f21c1204be099a988feffb244a85","track":null,"year":null}],"venue":"TMLR"},{"governance_note":"Approved ICML host allowlist; release governance must separately verify authority and currency.","official_hosts":["icml.cc"],"profiles":[{"profile_id":"icml-2026-main","profile_locator":"venues/profiles/icml-2026-main.json","profile_sha256":"c3867d607e95237c6afd04053b965716c0551e6700a62c01a993442f5e4950a8","profile_version":"1.0.0","source_manifest_locator":"venues/source-manifests/icml-2026-main.json","source_sha256":"ced6d8e8106ac5505ba2c7bcf6189d4d3eb308e042a62063191f23dea8ea5860","track":"main","year":2026}],"venue":"ICML"},{"governance_note":"Approved CVPR host allowlist; release governance must separately verify authority and currency.","official_hosts":["cvpr.thecvf.com"],"profiles":[{"profile_id":"cvpr-2026-main","profile_locator":"venues/profiles/cvpr-2026-main.json","profile_sha256":"07d8a53cabbfef926ea34dbd41a3e9c533d641abce70cad8f6a732527c0f70a8","profile_version":"1.0.0","source_manifest_locator":"venues/source-manifests/cvpr-2026-main.json","source_sha256":"8d2f8500e9f775db2315d0a2590e2b7f1411ceff099cb062073865e6f42c6af0","track":"main","year":2026}],"venue":"CVPR"},{"governance_note":"Approved ECCV host allowlist; release governance must separately verify authority and currency.","official_hosts":["eccv.ecva.net"],"profiles":[{"profile_id":"eccv-2026-main","profile_locator":"venues/profiles/eccv-2026-main.json","profile_sha256":"3d290513f27682a7ab359dd594f66b523d2afd68e6a6939311bf967878f94336","profile_version":"1.0.0","source_manifest_locator":"venues/source-manifests/eccv-2026-main.json","source_sha256":"b6a5f5f3c3201cdf8ef77db75bae6bedebc52ff624e594b4802a9934a458eff7","track":"main","year":2026}],"venue":"ECCV"}]}
